,name,city,state,nirfRank,rank
1072,Gharda Foundations Gharda Institute of Technology,Ratnagiri,Maharashtra,nan,nan
1073,"Ghatshila College, Ghatshila",GHATSILA,Jharkhand,nan,nan
1074,Gian Jyoti Institute of Management and Technology,Mohali,Punjab,nan,nan
1075,"Giani Zail Singh Campus College of Engineering & Technology, Bathinda",Bathinda,Punjab,nan,nan
1076,Girdari Lal Dogra Memorial Degree College,Hiranagar,Jammu and Kashmir,nan,nan
1077,Girijananda Chowdhury Institute of Management & Technology,Kamrup,Assam,nan,nan
1078,Girijananda Chowdhury Institute of Management and Technology,Tezpur,Assam,nan,nan
1079,Girraj Government College,Nizamabad,Telangana,nan,nan
1080,Gitai Institute of Management,Aurangabad,Maharashtra,nan,nan
1081,Gitam Dental College & Hospital,Vishakhapatnam,Andhra Pradesh,33,nan
1082,Global Academy of Technology,Bengaluru,Karnataka,nan,nan
1083,Global Institute of Engineering and Technology,Vellore,Tamil Nadu,nan,nan
1084,"Global Nature Care Group Sangathan Institution, Jabalpur",Jabalpur,Madhya Pradesh,nan,nan
1085,Global Research Institute of Management & Technology,Yamuna Nagar,Haryana,nan,nan
1086,Globsyn Business School,24 Paraganas (S),West Bengal,nan,nan
1087,Gnanamani College of Technology,Namakkal,Tamil Nadu,nan,nan
1088,Goa College of Engineering (Government of Goa),Ponda,Goa,nan,nan
1089,Goa College of Home Science Campal Panaji,Panaji,Goa,nan,nan
1090,Goa College of Music Altinho Panaji,Panaji,Goa,nan,nan
1091,Goa Medical College Bambolim,North Goa,Goa,nan,nan
1092,Goa Vidyaprasarak Mandals Gopal Govind Poy Raiturcar College of Commerce and Economics,North Goa,Goa,nan,nan
1093,Goalpara College,Goalpara,Assam,nan,nan
1094,Gobi Arts & Science College,Erode,Tamil Nadu,nan,nan
1095,Godavari Institute of Engineerin,Rajahmundry,Andhra Pradesh,212,nan
1096,Godavari Institute of Engineering & Technology,Rajahmundry,Andhra Pradesh,nan,nan
1097,Godutai Dodappa Appa Arts & Commerce College for Women,Gulbarga,Karnataka,nan,nan
1098,Gogte Institute of Techn,Belagavi,Karnataka,265,nan
1099,"Gogte Institute of Technology, Belgaum",Belagavi,Karnataka,nan,nan
1100,Gojan School of Business and Technology,Chennai,Tamil Nadu,nan,nan
1101,Goka Raju Ranga Raju Institute of Engineering & Technology,Hyderabad,Telangana,148,nan
1102,"Gokhale Education Society's R. H. Sapat College of Engineering, Management Studies and Research",Nashik,Maharashtra,nan,nan
1103,Gokhale Education Societys Shri Bhausaheb Vartak Arts Science and Commerce College,Mumbai-,Maharashtra,nan,nan
1104,Gokula Krishna College of Engineering,Sullurupeta,Andhra Pradesh,nan,nan
1105,Gonzaga College of Arts & Science for women,Krishnagiri,Tamil Nadu,nan,nan
1106,"Gopikabai Sitaram Gawande College, Umarkhed",Umarkhed,Maharashtra,nan,nan
1107,"Gopinath Singh Mahila College,Garhwa",Garhwa,Jharkhand,nan,nan
1108,Goswami Ganesh Dutta S.D. College,Chandigarh,Chandigarh,nan,nan
1109,Gouthami Institute of Technology & Management for Women,Proddatur,Andhra Pradesh,nan,nan
1110,Government Arts & Commerce College Jadar,Sabar Kantha,Gujarat,nan,nan
1111,"Government Arts & Science College, Armoor (5010)",Nizamabad,Telangana,nan,nan
1112,"Government Arts & Science College, Kozhinjampara",Palakkad,Kerala,nan,nan
1113,Government Arts And Commerce College,Sabarkantha,Gujarat,nan,nan
1114,Government Arts College,Ranavav,Gujarat,nan,nan
1115,Government Arts College,The Nilgiris,Tamil Nadu,nan,nan
1116,Government Arts College,MADURAI,Tamil Nadu,nan,nan
1117,Government Arts College,Dharmapuri,Tamil Nadu,nan,nan
1118,Government Arts College,Salem,Tamil Nadu,nan,nan
1119,Government Arts College,Coimbatore,Tamil Nadu,nan,nan
1120,Government Arts College,Tiruchirappalli,Tamil Nadu,nan,nan
1121,Government Arts College,Cuddalore,Tamil Nadu,nan,nan
1122,Government Arts College,Karur,Tamil Nadu,nan,nan
1123,Government Arts College Thiruvannamalai,Thiruvannamalai,Tamil Nadu,nan,nan
1124,Government Arts College for Men,Krishnagiri,Tamil Nadu,nan,nan
1125,Government Arts College for Women,Salem,Tamil Nadu,nan,nan
1126,Government Arts College for Women,Pudukkottai,Tamil Nadu,nan,nan
1127,"Government Arts College for Women, Sivaganga",Sivagangai,Tamil Nadu,nan,nan
1128,"Government Arts College, Ariyalur",Ariyalur,Tamil Nadu,nan,nan
1129,"Government Arts College, Chitradurga",Chitradurga,Karnataka,nan,nan
1130,"Government Arts College, Hassan",Hassan,Karnataka,nan,nan
1131,"Government Arts College, Karur",Karur,Tamil Nadu,nan,nan
1132,"Government Arts College, Kumbakonam",Kumbakonam,Tamil Nadu,nan,nan
1133,"Government Arts College, Maninagar",Ahmedabad,Gujarat,nan,nan
1134,"Government Arts College, Thiruvananthapuram",Thiruvananthapuram,Kerala,nan,nan
1135,"Government Arts College, Tiruppur",Udumalpet,Tamil Nadu,nan,nan
1136,"Government Arts Commerce College, Keolari, Seoni",keolari,Madhya Pradesh,nan,nan
1137,Government Arts and Commerce College,Jafrabad,Gujarat,nan,nan
1138,"Government Arts and Science College for Women , Barugur",Barugur,Tamil Nadu,nan,nan
1139,"Government Arts and Science College, Hosur",Krishnagiri,Tamil Nadu,nan,nan
1140,"Government Arts and Science College, Kangeyam",Tiruppur,Tamil Nadu,nan,nan
1141,"Government Arts and Science College, Komarapalayam",Namakkal,Tamil Nadu,nan,nan
1142,"Government Arts and Science College, Kovilpatti",kovilpatti,Tamil Nadu,nan,nan
1143,"Government Autonmous Science College, Civil Lines, Jabalpur",Jabalpur,Madhya Pradesh,nan,nan
1144,"Government Autonomous M.K.B. Arts & Commerce College for Women, Jabalpur",Jabalpur,Madhya Pradesh,nan,nan
1145,Government Brennen College,Kannur,Kerala,nan,nan
1146,Government Chatrsal College Pichore,PICHHORE,Madhya Pradesh,nan,nan
1147,Government City College,Hyderabad,Telangana,nan,nan
1148,Government College,Rajahmundry,Andhra Pradesh,nan,nan
1149,Government College,DURG,Chhattisgarh,nan,nan
1150,Government College,District Cuddpah,Andhra Pradesh,nan,nan
1151,Government College Alampur,alampur,Madhya Pradesh,nan,nan
1152,Government College Aroon,Aron,Madhya Pradesh,nan,nan
1153,Government College Baldwara (Mandi),Baldwara,Himachal Pradesh,nan,nan
1154,Government College Hamirpur,Hamirpur,Himachal Pradesh,nan,nan
1155,Government College Karera,Karera,Madhya Pradesh,nan,nan
1156,"Government College Kasaragod, Vidya Nagar",Kasaragod,Kerala,nan,nan
1157,Government College Kolaras,kolaras,Madhya Pradesh,nan,nan
1158,Government College Mahgoan,Bhind,Madhya Pradesh,nan,nan
1159,Government College Muganwali,MUNGAOLI,Madhya Pradesh,nan,nan
1160,Government College Ropar,Rupnagar,Punjab,nan,nan
1161,Government College Vijaypur,Sheopur,Madhya Pradesh,nan,nan
1162,Government College for Men,Kurnool,Andhra Pradesh,nan,nan
1163,"Government College for Men, Kadapa",Kadapa,Andhra Pradesh,nan,nan
1164,Government College for Women,"Gandhi Nagar, Dist. Jammu",Jammu and Kashmir,nan,nan
1165,Government College for Women (Autonomous),Srikakulam,Andhra Pradesh,nan,nan
1166,Government College for Women Nawakadal,"Nawakadal, Dist. Srinagar",Jammu and Kashmir,nan,nan
1167,"Government College for Women, Kumbakonam",KUMBAKONAM - 612 001,Tamil Nadu,nan,nan
1168,"Government College for Women, Parade Ground , Jammu",Jammu & Kashmir,Jammu and Kashmir,nan,nan
1169,"Government College for Women, Thiruvananthapuram",Thiruvananthapuram,Kerala,nan,nan
1170,"Government College for Women, Udhampur",Udhampur,Jammu and Kashmir,nan,nan
1171,Government College of Arts & Commerce Virnoda Pernem,Pernem,Goa,nan,nan
1172,Government College of Arts & Science,Aurangabad,Maharashtra,nan,nan
1173,Government College of Arts Science & Commerce Sanquelim,Sankhali,Goa,nan,nan
1174,"Government College of Arts Science & Commerce, Khandola",Marcela,Goa,nan,nan
1175,"Government College of Arts Science & Commerce, Quepem",South Goa,Goa,nan,nan
1176,"Government College of Commerce and Economics, Borda",Margao,Goa,nan,nan
1177,Government College of Engineering,Theni,Tamil Nadu,nan,nan
1178,Government College of Engineering,Kalahandi,Odisha,nan,nan
1179,Government College of Engineering,Keonjhar,Odisha,nan,nan
1180,Government College of Engineering,Kannur,Kerala,nan,nan
1181,Government College of Engineering,Krishnagiri,Tamil Nadu,nan,nan
1182,Government College of Engineering,Karad,Maharashtra,nan,nan
1183,Government College of Engineering,Salem,Tamil Nadu,nan,nan
1184,Government College of Engineering & Ceramic Technology,Kolkata,West Bengal,nan,nan
1185,Government College of Engineering & Leather Technology,Kolkata,West Bengal,nan,nan
1186,Government College of Engineering & Technology,Jammu,Jammu and Kashmir,nan,nan
1187,Government College of Engineering (Academic Autonomous),Aurangabad,Maharashtra,nan,nan
1188,Government College of Engineering and Research,Avasari (Khurd),Maharashtra,nan,nan
1189,"Government College of Engineering, Amravati",Amravati,Maharashtra,nan,nan
1190,"Government College of Engineering, Jalgaon",Jalgaon,Maharashtra,nan,nan
1191,Government College of Technology,Coimbatore,Tamil Nadu,160,nan
1192,"Government College, Attingal",Thiruvananthapuram,Kerala,nan,nan
1193,"Government College, Barwala",Barwala,Haryana,nan,nan
1194,"Government College, Ellenabad",Sirsa,Haryana,nan,nan
1195,"Government College, Gharaunda",Gharaunda,Haryana,nan,nan
1196,"Government College, Hisar",HISAR,Haryana,nan,nan
1197,"Government College, Indergarh, Datia",M.P,Madhya Pradesh,nan,nan
1198,"Government College, Ishagarh",ISHAGARH,Madhya Pradesh,nan,nan
1199,"Government College, Jind",Jind,Haryana,nan,nan
1200,"Government College, Kalka",Panchkula,Haryana,nan,nan
1201,"Government College, Kurwai, Vidisha",KURWAI,Madhya Pradesh,nan,nan
1202,"Government College, Lateri",Lateri,Madhya Pradesh,nan,nan
1203,"Government College, Mandi Dabwali",Dabwali,Haryana,nan,nan
1204,"Government College, Nalwa",Hisar,Haryana,nan,nan
1205,"Government College, Narnaul",Narnaul,Haryana,nan,nan
1206,"Government College, Narshingarh, Rajgarh",Narsinghgarh,Madhya Pradesh,nan,nan
1207,"Government College, Nattakom, Kottayam",Kottayam,Kerala,nan,nan
1208,"Government College, Nedumangad",Thiruvananthapuram,Kerala,nan,nan
1209,"Government College, Panchkula",Panchkula,Haryana,nan,nan
1210,"Government College, Phoop",Phoop,Madhya Pradesh,nan,nan
1211,"Government College, Shamshabad, Vidisha",Shamshabad,Madhya Pradesh,nan,nan
1212,"Government College,Rourkela",Sundargarh,Odisha,nan,nan
1213,Government D. B. P.G. Girls College kalibadi Chowk,Raipur,Chhattisgarh,nan,nan
1214,Government D. S. V. Sanskrit College,Raipur,Chhattisgarh,nan,nan
1215,Government Degree College,Veeraghattam,Andhra Pradesh,nan,nan
1216,Government Degree College,Tekkali,Andhra Pradesh,nan,nan
1217,Government Degree College,Chintalapudi,Andhra Pradesh,nan,nan
1218,Government Degree College,Uravakonda,Andhra Pradesh,nan,nan
1219,Government Degree College,Husnabad,Telangana,nan,nan
1220,Government Degree College,Punch,Jammu and Kashmir,nan,nan
1221,Government Degree College,Medchal,Telangana,nan,nan
1222,Government Degree College,Korutla,Telangana,nan,nan
1223,Government Degree College,Warangal (Rural),Telangana,nan,nan
1224,Government Degree College,Warangal,Telangana,nan,nan
1225,Government Degree College,"Huzurnagar, Suryapet District",Telangana,nan,nan
1226,Government Degree College,Seethamapeta,Andhra Pradesh,nan,nan
1227,Government Degree College,Srikakulam,Andhra Pradesh,nan,nan
1228,Government Degree College,Razole,Andhra Pradesh,nan,nan
1229,Government Degree College,Rajampeta,Andhra Pradesh,nan,nan
1230,Government Degree College,Nagari,Andhra Pradesh,nan,nan
1231,Government Degree College,Mandapeta,Andhra Pradesh,nan,nan
1232,Government Degree College,Karvetinagaram,Andhra Pradesh,nan,nan
1233,Government Degree College,Mendhar,Jammu and Kashmir,nan,nan
1234,Government Degree College,Chodavaram,Andhra Pradesh,nan,nan
1235,Government Degree College,Alur,Andhra Pradesh,nan,nan
1236,Government Degree College,Porumamilla,Andhra Pradesh,nan,nan
1237,Government Degree College,Ramachandrapuran,Andhra Pradesh,nan,nan
1238,Government Degree College,Anantnag,Jammu and Kashmir,nan,nan
1239,Government Degree College,Samba,Jammu and Kashmir,nan,nan
1240,Government Degree College,Akhnoor,Jammu and Kashmir,nan,nan
1241,Government Degree College,Reasi,Jammu and Kashmir,nan,nan
1242,Government Degree College,Kishtwar,Jammu and Kashmir,nan,nan
1243,Government Degree College,Yerraguntla,Andhra Pradesh,nan,nan
1244,Government Degree College,Kathua,Jammu and Kashmir,nan,nan
1245,Government Degree College,Yeleswaram,Andhra Pradesh,nan,nan
1246,Government Degree College (Autonomous),Siddipet,Telangana,nan,nan
1247,Government Degree College (Patancheru),Patancheru,Telangana,nan,nan
1248,Government Degree College (Sadasivpet),Sadasivpet,Telangana,nan,nan
1249,Government Degree College (Zaheerabad),Zaheerabad,Telangana,nan,nan
1250,"Government Degree College , Atmakur",Mahbubnagar,Telangana,nan,nan
1251,Government Degree College Agraharam,Vemulawada,Telangana,nan,nan
1252,"Government Degree College Chachora, Beenagang",CHACHODA ROAD BINAGANJ,Madhya Pradesh,nan,nan
1253,Government Degree College Lamgara,Lamgara,Uttarakhand,nan,nan
1254,Government Degree College Masi,ALMORA,Uttarakhand,nan,nan
1255,Government Degree College Narasanna Peta,Srikakulam,Andhra Pradesh,nan,nan
1256,Government Degree College Pakala -Rural Co-Ed.,Chittoor,Andhra Pradesh,nan,nan
1257,Government Degree College Porsa,MORENA,Madhya Pradesh,nan,nan
1258,"Government Degree College Pulwama, Kashmir",Pulwama,Jammu and Kashmir,nan,nan
1259,Government Degree College Radhogarh,Raghogarh,Madhya Pradesh,nan,nan
1260,Government Degree College Ravulapalem,Ravulapalem,Andhra Pradesh,nan,nan
1261,Government Degree College Sathyavedu Rural Co-Ed.,Satyavedu,Andhra Pradesh,nan,nan
1262,Government Degree College Srisailam Project,Kurnool,Andhra Pradesh,nan,nan
1263,Government Degree College Surankote,Surankote,Jammu and Kashmir,nan,nan
1264,Government Degree College Thannamandi,Rajouri,Jammu and Kashmir,nan,nan
1265,Government Degree College for Men,Srikakulam,Andhra Pradesh,nan,nan
1266,Government Degree College for Men,Adilabad,Telangana,nan,nan
1267,"Government Degree College for Men (Autonomous), Anantapur",Anantapur,Andhra Pradesh,nan,nan
1268,Government Degree College for Women,Wanaparthy,Telangana,nan,nan
1269,Government Degree College for Women,Nalgonda,Telangana,nan,nan
1270,Government Degree College for Women (Begumpet),Hyderabad,Telangana,nan,nan
1271,Government Degree College for Women (Hussainialam),Hyderabad,Telangana,nan,nan
1272,Government Degree College for Women (Sangareddy),Sangareddy,Telangana,nan,nan
1273,Government Degree College for Women (Siddipet),Siddipet,Telangana,nan,nan
1274,"Government Degree College for Women, Adilabad",Adilabad,Telangana,nan,nan
1275,"Government Degree College for Women, Guntur",Guntur,Andhra Pradesh,nan,nan
1276,"Government Degree College for Women, Jagtial",Jagtial,Telangana,nan,nan
1277,"Government Degree College for Women, Karimnagar",Karimnagar,Telangana,nan,nan
1278,"Government Degree College for Women, Madanapalle Urban",Madanapalle,Andhra Pradesh,nan,nan
1279,Government Degree College for women Sri kalahasthi Urban,Chittoor,Andhra Pradesh,nan,nan
1280,"Government Degree College, Alir",Yadadri Bhuvanagiri,Telangana,nan,nan
1281,"Government Degree College, Amarpur",Amarpur,Tripura,nan,nan
1282,"Government Degree College, Amarwara",Amarwara,Madhya Pradesh,nan,nan
1283,"Government Degree College, Avangadda",Avanigadda,Andhra Pradesh,nan,nan
1284,"Government Degree College, Banbasa",Champawat,Uttarakhand,nan,nan
1285,"Government Degree College, Banganapalli",Banaganapalle,Andhra Pradesh,nan,nan
1286,"Government Degree College, Bantumilli",Bantumilli,Andhra Pradesh,nan,nan
1287,"Government Degree College, Bellampally",Bellampally,Telangana,nan,nan
1288,"Government Degree College, Bhua Bichhiya, Mandla",BHUABICHHIYA,Madhya Pradesh,nan,nan
1289,"Government Degree College, Bhupalpally",Bhoopalpalli,Telangana,nan,nan
1290,"Government Degree College, Bichhua",Chhindwara,Madhya Pradesh,nan,nan
1291,"Government Degree College, Bodhan (5007)",Bodhan,Telangana,nan,nan
1292,"Government Degree College, Chebrole",Chebrole,Andhra Pradesh,nan,nan
1293,"Government Degree College, Cheepurupalli",Vizianagaram,Andhra Pradesh,nan,nan
1294,"Government Degree College, Chintapalli",Visakhapatnam,Andhra Pradesh,nan,nan
1295,"Government Degree College, Chinyalisaur",chinyalisaur,Uttarakhand,nan,nan
1296,"Government Degree College, Cumbum",Cumbum,Andhra Pradesh,nan,nan
1297,"Government Degree College, Devidhura",Champawat,Uttarakhand,nan,nan
1298,"Government Degree College, Dharmanagar",Dharmanagar,Tripura,nan,nan
1299,"Government Degree College, Dharpally",Nizamabad,Telangana,nan,nan
1300,"Government Degree College, Eluru",Eluru,Andhra Pradesh,nan,nan
1301,"Government Degree College, Eturu Nagaram",Warangal (Rural),Telangana,nan,nan
1302,"Government Degree College, Ganai Gangoli",Pithoragarh,Uttarakhand,nan,nan
1303,"Government Degree College, Garla",Mahabubabad,Telangana,nan,nan
1304,"Government Degree College, Godhavarikhani",Karimnagar,Telangana,nan,nan
1305,"Government Degree College, Jaggampeta",Jaggampeta,Andhra Pradesh,nan,nan
1306,"Government Degree College, Jammalamadugu",Jammalamadugu,Andhra Pradesh,nan,nan
1307,"Government Degree College, Kamalpur",Kamalpur,Tripura,nan,nan
1308,"Government Degree College, Kanchanpur",Kanchanpur,Tripura,nan,nan
1309,"Government Degree College, Khumlwng",Khumulwng,Tripura,nan,nan
1310,"Government Degree College, Kommavarapukota",Kamavarapukota,Andhra Pradesh,nan,nan
1311,"Government Degree College, Kotabag",Tahsil - Kaladungi,Uttarakhand,nan,nan
1312,"Government Degree College, Kuppam Rural Co-Ed.",Chittoor,Andhra Pradesh,nan,nan
1313,"Government Degree College, Laksar, Haridwar","Laksar, Haridwar",Uttarakhand,nan,nan
1314,"Government Degree College, Lambgaon",Tehri Garhwal,Uttarakhand,nan,nan
1315,"Government Degree College, Longtarai Valley",Chailengta,Tripura,nan,nan
1316,"Government Degree College, Luxettipet",Luxettipet,Telangana,nan,nan
1317,"Government Degree College, Madhira",Madhira,Telangana,nan,nan
1318,"Government Degree College, Mahanpur",Kathua,Jammu and Kashmir,nan,nan
1319,"Government Degree College, Majra Mahadev",MAJRA MAHADEV,Uttarakhand,nan,nan
1320,"Government Degree College, Malkajgiri",Hyderabad,Telangana,nan,nan
1321,"Government Degree College, Mancherial",Adilabad,Telangana,nan,nan
1322,"Government Degree College, Manglore",MANGLORE,Uttarakhand,nan,nan
1323,"Government Degree College, Manthani",Manthani,Telangana,nan,nan
1324,"Government Degree College, Margubpur (Roorkee)",Roorkee (Haridwar),Uttarakhand,nan,nan
1325,"Government Degree College, Naidupeta",Sri Potti Sriramulu Nellore,Andhra Pradesh,nan,nan
1326,"Government Degree College, Nandikotkur",Kurnool,Andhra Pradesh,nan,nan
1327,"Government Degree College, Nowshera",Nowshera,Jammu and Kashmir,nan,nan
1328,"Government Degree College, Paloncha",Khammam,Telangana,nan,nan
1329,"Government Degree College, Pathapatnam",Srikakulam,Andhra Pradesh,nan,nan
1330,"Government Degree College, Peddapalli",Peddapalli,Telangana,nan,nan
1331,"Government Degree College, Pithapuram",Pithapuram,Andhra Pradesh,nan,nan
1332,"Government Degree College, Pokhra",Pauri Garhwal,Uttarakhand,nan,nan
1333,"Government Degree College, Purola",PUROLA,Uttarakhand,nan,nan
1334,"Government Degree College, Rajam",Sikakulam,Andhra Pradesh,nan,nan
1335,"Government Degree College, Rikhnikhal",Rikhnikhal,Uttarakhand,nan,nan
1336,"Government Degree College, S. Kota",Srungavarapu Kota,Andhra Pradesh,nan,nan
1337,"Government Degree College, Sabbavaram",Sabbavaram,Andhra Pradesh,nan,nan
1338,"Government Degree College, Salur",Vizianagaram,Andhra Pradesh,nan,nan
1339,"Government Degree College, Satpuli",Satpuli,Uttarakhand,nan,nan
1340,"Government Degree College, Seethanagaram",Seethanagaram,Andhra Pradesh,nan,nan
1341,"Government Degree College, Sitarganj",SITARGANJ,Uttarakhand,nan,nan
1342,"Government Degree College, Teliamura",Teliamura,Tripura,nan,nan
1343,"Government Degree College, Thalisain",Pauri,Uttarakhand,nan,nan
1344,"Government Degree College, Thatyud",Thatyud,Uttarakhand,nan,nan
1345,"Government Degree College, Thorrur",Thorrur,Telangana,nan,nan
1346,"Government Degree College, Tiruvuru",Krishna,Andhra Pradesh,nan,nan
1347,"Government Degree College, Tuni",Tuni,Andhra Pradesh,nan,nan
1348,"Government Degree College, Tyuni (Dehradun)",Dehradun,Uttarakhand,nan,nan
1349,"Government Degree College, Udayagiri",Udayagiri,Andhra Pradesh,nan,nan
1350,"Government Degree College, V-Madugula",Visakhapatnam,Andhra Pradesh,nan,nan
1351,"Government Degree College, Wardhannapet",Wardhannapet,Telangana,nan,nan
1352,"Government Degree College, Yerragondapalem",Yerragondapalem,Andhra Pradesh,nan,nan
1353,"Government Degree College, kanda",Kanda,Uttarakhand,nan,nan
1354,"Government Degree College,Nainbagh",NAINBAGH,Uttarakhand,nan,nan
1355,"Government Degree Collge, Gandacharra",Dhalai,Tripura,nan,nan
1356,"Government Degree Collge, Santirbazer",Santirbazar,Tripura,nan,nan
1357,"Government Degree Degree College, Hyderabad",Hyderabad,Telangana,nan,nan
1358,Government Dental College,Thiruvananthapuram,Kerala,30,nan
1359,Government Dental College,Ahmedabad,Gujarat,36,nan
1360,"Government Dental College, Bangalore",Bangalore,Karnataka,18,nan
1361,Government Dr. Bhagwat Sahay College,GWALIOR,Madhya Pradesh,nan,nan
1362,Government Dr. Waman Vasudev Patankar Girls College,Durg,Chhattisgarh,nan,nan
1363,Government Engineering Col,Thrissur,Kerala,213,nan
1364,Government Engineering College,Rajkot,Gujarat,nan,nan
1365,Government Engineering College,Bharuch,Gujarat,nan,nan
1366,Government Engineering College,Godhra,Gujarat,nan,nan
1367,Government Engineering College,Haveri,Karnataka,nan,nan
1368,Government Engineering College,Palanpur,Gujarat,nan,nan
1369,Government Engineering College,Trivandrum,Kerala,nan,nan
1370,Government Engineering College Bilaspur,Bilaspur,Chhattisgarh,nan,nan
1371,Government Engineering College Raipur,Raipur,Chhattisgarh,nan,nan
1372,"Government Engineering College, Ballarpur Road",Chandrapur,Maharashtra,nan,nan
1373,"Government Engineering College, Hassan",Hassan,Karnataka,nan,nan
1374,"Government Engineering College, Jagdalpur",Jagdalpur,Chhattisgarh,nan,nan
1375,"Government Engineering College, Jhalawar",Jhalawar,Rajasthan,nan,nan
1376,"Government Engineering College, Kozhikode",Kozhikode,Kerala,nan,nan
1377,"Government Engineering College, Modasa",Modasa,Gujarat,nan,nan
1378,"Government Engineering College, Ramanagara",RAMANAGARA,Karnataka,nan,nan
1379,"Government Engineering College, Thrissur",Thrissur,Kerala,nan,nan
1380,"Government Engineering College, Valsad",Valsad,Gujarat,nan,nan
1381,"Government FGC, Hoskote, Bangalore",Bangalore Rural,Karnataka,nan,nan
1382,"Government First Grade BA, B.Com & BBA College, Raibag",Raibag,Karnataka,nan,nan
1383,Government First Grade College,Dakshina Kannada,Karnataka,nan,nan
1384,Government First Grade College,MUDALAGI,Karnataka,nan,nan
1385,Government First Grade College,Chikkaballapura,Karnataka,nan,nan
1386,Government First Grade College,HARIHARA,Karnataka,nan,nan
1387,Government First Grade College,KRISHNARAJAPETE,Karnataka,nan,nan
1388,"Government First Grade College & PG Center, Chintaman",Chintamani,Karnataka,nan,nan
1389,Government First Grade College Gundlupet,Gundlupet,Karnataka,nan,nan
1390,Government First Grade College Kalgi,Kalagi,Karnataka,nan,nan
1391,Government First Grade College Zalaki,Zalaki,Karnataka,nan,nan
1392,"Government First Grade College for Women, Haveri",Haveri,Karnataka,nan,nan
1393,"Government First Grade College for Women, K.R Pet",K R Pet,Karnataka,nan,nan
1394,"Government First Grade College, Arakalagud",Hassan,Karnataka,nan,nan
1395,"Government First Grade College, Athani",Athani,Karnataka,nan,nan
1396,"Government First Grade College, Ayanur",Shimoga,Karnataka,nan,nan
1397,"Government First Grade College, Banavara",Hassan,Karnataka,nan,nan
1398,"Government First Grade College, Bangarpet",KOLAR,Karnataka,nan,nan
1399,"Government First Grade College, Baramasagara",Bharamasagara,Karnataka,nan,nan
1400,"Government First Grade College, Bilikere",Mysore,Karnataka,nan,nan
1401,"Government First Grade College, Chikkaballapur Dist.",Gauribidanur,Karnataka,nan,nan
1402,"Government First Grade College, Chikkabasur",Haveri,Karnataka,nan,nan
1403,"Government First Grade College, H.D.Kote",Mysore,Karnataka,nan,nan
1404,"Government First Grade College, Honnali",Davanagere,Karnataka,nan,nan
1405,"Government First Grade College, Hosadurga",Hosadurga,Karnataka,nan,nan
1406,"Government First Grade College, Hunagund",Bagalkot,Karnataka,nan,nan
1407,"Government First Grade College, Javagal",Arsikere Tq.,Karnataka,nan,nan
1408,"Government First Grade College, Jayanagar",Bangalore,Karnataka,nan,nan
1409,"Government First Grade College, K R S, S.R Patna",K.R.Sagara,Karnataka,nan,nan
1410,"Government First Grade College, K.R. Puram, Bangalore",Bengaluru,Karnataka,nan,nan
1411,"Government First Grade College, Kalasa","Kalasa ,Mudigere Taluk",Karnataka,nan,nan
1412,"Government First Grade College, Kokatanoor",Kokatanoor,Karnataka,nan,nan
1413,"Government First Grade College, Koteshwara",Kundapura,Karnataka,nan,nan
1414,"Government First Grade College, Kundgol.",Kundgol,Karnataka,nan,nan
1415,"Government First Grade College, Kunigal",Kunigal,Karnataka,nan,nan
1416,"Government First Grade College, Muddebihal",Bijapur,Karnataka,nan,nan
1417,"Government First Grade College, Nanjangud",Mysore,Karnataka,nan,nan
1418,"Government First Grade College, Nyamati",Davanagere,Karnataka,nan,nan
1419,"Government First Grade College, Parushurampura",Chitradurga,Karnataka,nan,nan
1420,"Government First Grade College, Sakleshpura",Hassan,Karnataka,nan,nan
1421,"Government First Grade College, Savalgi",Bagalkot,Karnataka,nan,nan
1422,"Government First Grade College, Shiralakoppa",Shimoga,Karnataka,nan,nan
1423,"Government First Grade College, T. Narasipura",Mysore,Karnataka,nan,nan
