,name,city,state,nirfRank,rank
3187,Rajiv Gandhi Institute of Information Technology and Biotechnology (RGIITBT),Pune,Maharashtra,nan,nan
3188,Rajiv Gandhi Institute of Petroleum Technology,Amethi,Uttar Pradesh,182,nan
3189,Rajiv Gandhi Institute of Technology,Kottayam,Kerala,nan,nan
3190,"Rajiv Gandhi Memorial College, Baroda",SHEOPUR,Madhya Pradesh,nan,nan
3191,Rajiv Gandhi Proudyogiki V,Bhopal,Madhya Pradesh,289,nan
3192,Rajiv Gandhi Proudyogiki Vishwavidyalaya,Bhopal,Madhya Pradesh,nan,nan
3193,Rajiv Gandhi University of Knowledge Technologies,Nuzvid,Andhra Pradesh,nan,nan
3194,Rajkiya Engineering College Banda,Banda,Uttar Pradesh,nan,nan
3195,"Rajkiya Engineering College, Ambedkar Nagar",Ambedkar Nagar,Uttar Pradesh,nan,nan
3196,"Rajkiya Engineering College, Azamgarh",Azamgarh,Uttar Pradesh,nan,nan
3197,"Rajkiya Engineering College, Kannauj",Kannauj,Uttar Pradesh,nan,nan
3198,"Rajkiya Mahila Mahavidyalaya, Bindki",FATEHPUR,Uttar Pradesh,nan,nan
3199,"Rajkiya Mahila Snatkottar Mahavidyalaya, Ghazipur",Ghazipur,Uttar Pradesh,nan,nan
3200,"Rajkiya engineering college, sonbhadra",sonbhadra,Uttar Pradesh,nan,nan
3201,Rajshree Institute of Management & Technology,Bareilly,Uttar Pradesh,nan,nan
3202,Ram Sahai Mull More College (R. S. More College),Dhanbad,Jharkhand,nan,nan
3203,"Ram Tahal Choudhary College, Ranchi",RANCHI,Jharkhand,nan,nan
3204,"Rama Devi Bajla Mahila Mahavidyalaya, Deoghar",Deoghar,Jharkhand,nan,nan
3205,Rama Krishna Mission Vivekananda Centenary College,Rahara,West Bengal,nan,nan
3206,Ramachandra College of Engineering,Eluru,Andhra Pradesh,nan,nan
3207,"Ramakrishna Mahavidyalaya , Darapur",Amravati,Maharashtra,nan,nan
3208,Ramakrishna Mission Residential College,Kolkata,West Bengal,nan,nan
3209,Ramakrishna Mission Siksha Mandir,Howrah,West Bengal,nan,nan
3210,Ramakrishna Mission Vidyamandira,Howrah,West Bengal,nan,nan
3211,"Ramanand Arya D.A.V. College, Mumbai",MUMBAI,Maharashtra,nan,nan
3212,Ramanujan College,New Delhi,Delhi,nan,nan
3213,Ramco Institute of Technology,Virudhunagar,Tamil Nadu,nan,nan
3214,"Ramgarh College, Ramgarh",Ramgarh,Jharkhand,nan,nan
3215,"Ramgovind Institute of Technology, Koderma",Koderma,Jharkhand,nan,nan
3216,Rami Reddy Subbarami Reddy Engineering College,Sri Potti Sriramulu Nellore,Andhra Pradesh,nan,nan
3217,Ramjas College,Delhi,Delhi,nan,nan
3218,Ramkrishna Mahavidyalaya,"Kailashahar, Tripura",Tripura,nan,nan
3219,Ramkrishna Paramhansa Mahavidhyalaya,Osmanabad,Maharashtra,nan,nan
3220,Rammohan College,Kolkata,West Bengal,nan,nan
3221,Ramrao Adik Institute,Navi Mumbai,Maharashtra,290,nan
3222,Ramrao Adik Institute of Technology,Navi Mumbai,Maharashtra,nan,nan
3223,Ramthakur College,Agartala,Tripura,nan,nan
3224,"Ranchi University, Ranchi",Ranchi,Jharkhand,nan,nan
3225,Ranchi Women's College,RANCHI,Jharkhand,nan,nan
3226,Rangapara College,Sonitpur,Assam,nan,nan
3227,Rani Anna Government College for Women,Tirunelveli,Tamil Nadu,nan,nan
3228,Rani Birla Girls College,Kolkata,West Bengal,nan,nan
3229,"Rani Channamma University, Belagavi",Belagavi,Karnataka,nan,nan
3230,Rani Durgavati Vishwavidyalaya,Jabalpur,Madhya Pradesh,nan,nan
3231,"Rani Laxmibai women's Arts Commerce and Science College, Sawargaaon",NAGPUR,Maharashtra,nan,nan
3232,Raniganj Girls' College,RANIGANJ,West Bengal,nan,nan
3233,"Ranveer Rananjai Snatkottar Mahavidyalaya, Amethi",Amethi,Uttar Pradesh,nan,nan
3234,Rao Bahaddur Y Mahabaleshwarappa Engineering College,Ballari,Karnataka,nan,nan
3235,Rashtrapita Mahatma Gandhi Arts and Commerce College,Saoli,Maharashtra,nan,nan
3236,Rashtrpita Mahatma Gandhi Arts Science College,Nagbhid,Maharashtra,nan,nan
3237,Rathinam College of Arts and Science,Coimbatore,Tamil Nadu,nan,nan
3238,Rathinam Technical Campus,Coimbatore,Tamil Nadu,nan,nan
3239,Rathnavel Subramaniam College of Arts and Science,Coimbatore,Tamil Nadu,nan,nan
3240,"Ratnam College of Arts Science and Commerce, West Mumbai",Mumbai,Maharashtra,nan,nan
3241,Ravindra College of Engineering for Women,Kurnool,Andhra Pradesh,nan,nan
3242,Rayat Bahra University,Sahibzada Ajit Singh Nagar,Punjab,nan,nan
3243,"Rayat Shikshan Sanstha`s Annasaheb Awate Arts, Commerce, Hutatma Babu Genu Science College",Manchar,Maharashtra,nan,nan
3244,Rayat Shikshan Sanstha`s C. D. Jain College of Commerce,Shrirampur,Maharashtra,nan,nan
3245,"Rayat Shikshan Sanstha`s Dada Patil Mahavidyalaya Arts, Science & Commerce",Karjat,Maharashtra,nan,nan
3246,"Rayat Shikshan Sanstha`s Dr. Babasaheb Ambedkar Mahavidyalaya Arts, Science & Commerce",Pune,Maharashtra,nan,nan
3247,Rayat Shikshan Sanstha`s Karmveer Bhaurao Patil College,Navi Mumbai,Maharashtra,nan,nan
3248,"Rayat Shikshan Sanstha`s Maharaja Jivajirao Shinde Arts, Science & Commerce College",Shrigonda,Maharashtra,nan,nan
3249,"Rayat Shikshan Sanstha`s Mahatama Phule Mahavidyalaya Arts, Science & Commerce",Pimpri-Chinchwad,Maharashtra,nan,nan
3250,"Rayat Shikshan Sanstha`s Radhabai Kale Arts, Science & Commerce College for Women",Ahmednagar,Maharashtra,nan,nan
3251,"Rayat Shikshan Sanstha`s S. S. G. M. Science, Gautam Arts & Sanjeevani Commerce College",Kopargaon,Maharashtra,nan,nan
3252,Rayat Shikshan Sansthas Abasaheb Marathe Arts & New Commerce Science College,Ratnagiri,Maharashtra,nan,nan
3253,Rayburn College,Churachandpur,Manipur,nan,nan
3254,Regent Education & Research Foundation Group of Institutions,Kolkata,West Bengal,nan,nan
3255,Regional Institute of Medical Sciences,nan,nan,46,nan
3256,Regional Institute of Medical Sciences,Imphal West,Manipur,nan,nan
3257,Regional institute of Mentally Handicapped,Chandigarh,Chandigarh,nan,nan
3258,Remuna Degree College,Baleswar,Odisha,nan,nan
3259,"Renuka Arts College, Ring Road",Nagpur,Maharashtra,nan,nan
3260,Reva University,Bengaluru,Karnataka,nan,nan
3261,Rewa Engineering College,Rewa,Madhya Pradesh,nan,nan
3262,Rishi Dayaram National College of Arts and Commerce and Wassiamul Assomul Science College,Mumbai,Maharashtra,nan,nan
3263,Rishi Galav College Morena(M.P.),MORENA,Madhya Pradesh,nan,nan
3264,Rishi M.S. Institute of Engineering & Technology for Women,Hyderabad,Telangana,nan,nan
3265,Rishiraj College of Dental Sciences & Research Centre,Bhopal,Madhya Pradesh,nan,nan
3266,"Ritambara Vishwa Vidyapeeths Malini Kishor College of Commerce and Economics, West Mumbai",Mumbai,Maharashtra,nan,nan
3267,Roever Engineering College,Elambalur,Tamil Nadu,nan,nan
3268,Rofel Arts & Commerce College,Vapi,Gujarat,nan,nan
3269,Rohini College of Engineering And Technology,Kanyakumari,Tamil Nadu,nan,nan
3270,Roorkee College of Engineering,Roorkee,Uttarakhand,nan,nan
3271,Roorkee Institute of Technology,Roorkee,Uttarakhand,nan,nan
3272,Rosary College of Commerce & Arts Navelim,South Goa,Goa,nan,nan
3273,Rourkela Law College,ROURKELA,Odisha,nan,nan
3274,Royal Academy of Law,Oinam,Manipur,nan,nan
3275,"Rukmani Ben DeepchandGardi Medical College, Charitable Hospital, Ujjain",Ujjain,Madhya Pradesh,nan,nan
3276,Rungta College of Engineering & Technology,Bhilai,Chhattisgarh,nan,nan
3277,Rustamji Institute of Technology,Tekanpur,Madhya Pradesh,nan,nan
3278,"S B Arts and KCP Science College, Bijapur",Vijayapur,Karnataka,nan,nan
3279,"S B D Kala evam Vigyan Mahavidyalya, Nagra, Porsa",PORSA,Madhya Pradesh,nan,nan
3280,S B Patil Institute of Dental Sciences & Research,BIDAR,Karnataka,nan,nan
3281,"S D M J College, M S Road, Morena",MORENA,Madhya Pradesh,nan,nan
3282,S J C Institute of Technology,Chickballapur,Karnataka,nan,nan
3283,"S P College, Dumka",DUMKA,Jharkhand,nan,nan
3284,S P K.Mahavidyalaya,Sawantwadi,Maharashtra,nan,nan
3285,"S P Mahila College, Dumka",DUMKA,Jharkhand,nan,nan
3286,"S S Jain Subodh P G College, Jaipur",Jaipur,Rajasthan,nan,nan
3287,S. A. Engineering College,Thiruvallur,Tamil Nadu,nan,nan
3288,S. A. Jain College,Ambala,Haryana,nan,nan
3289,S. A. S. Government Degree College,Narayanapuram,Andhra Pradesh,nan,nan
3290,S. B. Garda Arts College & P. K. Patel College of Commerce,Navsari,Gujarat,nan,nan
3291,S. B. Jain Institute of Technology Management and Research,Nagpur,Maharashtra,nan,nan
3292,S. B. Patil College of Engineering,Indapur,Maharashtra,nan,nan
3293,S. D. Jain Girls College,Dimapur,Nagaland,nan,nan
3294,S. D. M. College of Engineerin,Dharwad,Karnataka,291,nan
3295,S. D. M. College of Engineering & Technology,Dharwad,Karnataka,nan,nan
3296,S. D. M. Law College,Mangaluru,Karnataka,nan,nan
3297,S. D. M. S. M Kalasala,Krishna,Andhra Pradesh,nan,nan
3298,"S. E. A. College of Arts, Science & Commerce",Bengaluru,Karnataka,nan,nan
3299,S. G. M. College,RANCHI,Jharkhand,nan,nan
3300,S. G. S. (Smt. Gentela Sakuntalamma) College,Jaggayyapet,Andhra Pradesh,nan,nan
3301,S. K. S. D. Mahila Kalasala,Tanuku,Andhra Pradesh,nan,nan
3302,S. N. M. College,Ernakulam,Kerala,nan,nan
3303,S. P. Jain Institute of Management & Research,nan,nan,21,nan
3304,S. R. V. B. S. J. B. Maharani College,Peddapuram,Andhra Pradesh,nan,nan
3305,S. S. & N. College,Guntur,Andhra Pradesh,nan,nan
3306,S. S. G. S. Degree College,Guntakal,Andhra Pradesh,nan,nan
3307,S. S. M. Law College,Jalgaon,Maharashtra,nan,nan
3308,S. S. P. Jain Arts & Commerce College,Surendranagar,Gujarat,nan,nan
3309,S. S. S. Government Degree College,Anantapur,Andhra Pradesh,nan,nan
3310,S. T. S. N. Government Degree College,Anantapur,Andhra Pradesh,nan,nan
3311,S. V. A. Government College,Srikalahasti,Andhra Pradesh,nan,nan
3312,S. V. K. P. & Dr. K. S. Raju Arts & Science College,Penugonda,Andhra Pradesh,nan,nan
3313,"S.A. Manvi Law College, Gadag",Gadag,Karnataka,nan,nan
3314,S.B College of Commerce Gulbarga,Gulbarga,Karnataka,nan,nan
3315,S.B College of Science Gulbarga,Gulbarga,Karnataka,nan,nan
3316,"S.B. College, Changanacherry",Kottayam,Kerala,nan,nan
3317,S.B. Deorah College,Kamrup,Assam,nan,nan
3318,S.B.K. College,Aruppukottai,Tamil Nadu,nan,nan
3319,S.B.M.S. College,Kamrup,Assam,nan,nan
3320,S.C.I.M. Government College,West Godavari,Andhra Pradesh,nan,nan
3321,S.D. College,Hoshiarpur,Punjab,nan,nan
3322,"S.D. College, Ambala",Ambala,Haryana,nan,nan
3323,"S.D. College, Panipat",Panipat,Haryana,nan,nan
3324,S.D.S.(Autonomous) College of Arts & Science,Garividi,Andhra Pradesh,nan,nan
3325,"S.E.S College Sreekandapuram, Kannur",Kannur,Kerala,nan,nan
3326,"S.G.K Government Degree College, Vinukonda",Guntur,Andhra Pradesh,nan,nan
3327,"S.G.S. Arts College, Tiruchanoor Road, Tirupati Urban",TIRUPATI,Andhra Pradesh,nan,nan
3328,S.I.W.S. N.R. Swamy College of Commerce & Economics and Smt. Thirumalai College of Science,Mumbai,Maharashtra,nan,nan
3329,S.K. Women's College,Bishnupur,Manipur,nan,nan
3330,S.K.B.R. Government College,Macherla,Andhra Pradesh,nan,nan
3331,S.K.E. Society`s RPD College of Arts and Commerce,Belagavi,Karnataka,nan,nan
3332,S.K.P. Government College,Guntakal,Andhra Pradesh,nan,nan
3333,S.K.R. Government Degree College,Nellore,Andhra Pradesh,nan,nan
3334,S.L.G. Degree College,Vizianagaram,Andhra Pradesh,nan,nan
3335,"S.M.J.N P.G College, Haridwar",Haridwar,Uttarakhand,nan,nan
3336,"S.N. College, Nattika",Thrissur,Kerala,nan,nan
3337,S.N.D.T. Arts & Commerce College for Women,Pune,Maharashtra,nan,nan
3338,S.N.D.T. College of Arts and Smt. C.B. College of Commerce and Science for Women,Mumbai,Maharashtra,nan,nan
3339,S.R.D. College Morena,Morena,Madhya Pradesh,nan,nan
3340,S.R.Government Degree College,Chittoor,Andhra Pradesh,nan,nan
3341,S.R.M. Institute of Science and Technology,Chennai,Tamil Nadu,nan,19
3342,S.R.M. Institute of Science and Technology,nan,nan,20,nan
3343,S.R.M. Institute of Science and Technology ,Chennai,Tamil Nadu,nan,nan
3344,S.R.M.S. Institute of Medical Sciences,Bareilly,Uttar Pradesh,nan,nan
3345,S.R.Naidu Memorial College,Sattur,Tamil Nadu,nan,nan
3346,S.R.R. & C.V.R. Government Degree College,VIJAYAWADA,Andhra Pradesh,nan,nan
3347,"S.S. College, Chas",BOKARO STEEL CITY,Jharkhand,nan,nan
3348,"S.S.A. Arts and Commerce College, DIST-SOLAPUR",Solapur,Maharashtra,nan,nan
3349,S.S.College,Hailakandi,Assam,nan,nan
3350,"S.S.L.N.T Mahila College, Dhanbad",Dhanbad,Jharkhand,nan,nan
3351,S.S.M. College Dina Nagar,Gurdaspur,Punjab,nan,nan
3352,"S.S.V. College, Valayanchirangara, Perumbavoor",Ernakulam,Kerala,nan,nan
3353,"S.T.Hindu College, Nagercoil",Nagercoil,Tamil Nadu,nan,nan
3354,S.V. Arts & Science College,Giddalur,Andhra Pradesh,nan,nan
3355,S.V.D. Government Degree College for Women,West Godavari,Andhra Pradesh,nan,nan
3356,"S.V.G.M. Government Degree College, Kalyandurg",Kalyandurg,Andhra Pradesh,nan,nan
3357,S.V.L.N.S. Government Degree College,Visakhapatnam,Andhra Pradesh,nan,nan
3358,S.V.R.K. Government Degree College for Men,"Nidadavole, West Godavari",Andhra Pradesh,nan,nan
3359,S.V.R.M. College,Guntur,Andhra Pradesh,nan,nan
3360,S.V.S.S.C. Government Degree College,Sullurpet,Andhra Pradesh,nan,nan
3361,S.V.T. College of Home Science (Autonomous College),Mumbai Suburban,Maharashtra,nan,nan
3362,"S.Y.T.R. Government Degree College, Madakasira",Anantapur,Andhra Pradesh,nan,nan
3363,SAFI Institute of Advanced Study,Malappuram,Kerala,nan,nan
3364,"SAGE University, Indore",Indore,Madhya Pradesh,nan,nan
3365,SAL Institute of Technology & Engineering Research,Ahmedabad,Gujarat,nan,nan
3366,"SARADA KRISHNA HOMOEOPATHY MEDICAL COLLEGE, KANNYAKUMARI",Kulasekharam,Tamil Nadu,nan,nan
3367,SARASWATI DENTAL COLLEGE & HOSPITAL,Lucknow,Uttar Pradesh,nan,nan
3368,"SBSSPSJ College, Godda",pathargama,Jharkhand,nan,nan
3369,SCAD College of Engineering and Technology,Cheranmahadevi,Tamil Nadu,nan,nan
3370,SCB Medical College and Hospital,Cuttack,Odisha,nan,nan
3371,SCB Medical College and Hospital,nan,nan,44,nan
3372,SCMS School of Engineering & Technology,Cochin,Kerala,nan,nan
3373,SCTR's Pune Institute of Computer Technology,Pune,Maharashtra,nan,nan
3374,SDM College of Dental Sciences & Hospital,Dharwad,Karnataka,20,nan
3375,SDM Institute of Technology,Ujire,Karnataka,nan,nan
3376,SDM Medical College,Dharwad,Karnataka,nan,nan
3377,SDNB Vaishnav College,Chennai,Tamil Nadu,nan,nan
3378,"SEA College of Engineering & Technology, Bangalore",Bangalore,Karnataka,nan,nan
3379,SECT College for Professional Education,Bhopal,Madhya Pradesh,nan,nan
3380,"SES's H.R.Patel Arts Mahila Mahavidyalaya, Shirpur",Shirpur,Maharashtra,nan,nan
3381,"SES`S R.C. Patel Institute of Technology, Shirpur",Shirpur,Maharashtra,nan,nan
3382,SF's Sandip Institute of Technology and Research Centre,Mahiravani,Maharashtra,nan,nan
3383,"SIES (NERUL) College of Arts, Science and Commerce , Navi Mumbai",Navi Mumbai,Maharashtra,nan,nan
3384,SIES Graduate School of Technology,Navi Mumbai,Maharashtra,nan,nan
3385,SJB Institute Of Technology,Bengaluru,Karnataka,nan,nan
3386,"SJB School of Aarchitecture and Planning, Kengeri",Bengaluru,Karnataka,nan,nan
3387,"SKES`S G S Science College, Belgaum",Belagavi,Karnataka,nan,nan
3388,SKN Sinhagad College of Engineering,Pandharpur,Maharashtra,nan,nan
3389,"SKNR Government Arts and Science College, Jagtial",JAGTIAL,Telangana,nan,nan
3390,"SKR & SKR College for Women, Kadapa",Y.S.R Kadapa,Andhra Pradesh,nan,nan
3391,SKSC Degree College,PRODDATUR,Andhra Pradesh,nan,nan
3392,"SM Patel College of Home Science, Vallabh Vidyanagar",Vallabh Vidyanagar,Gujarat,nan,nan
3393,"SML Government Degree College, Yemmiganur",Kurnool,Andhra Pradesh,nan,nan
3394,"SN College, Chempazhanthy, Thiruvananthapuram",Thiruvananthapuram,Kerala,nan,nan
3395,SNS College,Coimbatore,Tamil Nadu,243,nan
3396,SNS College of Engineering,Coimbatore,Tamil Nadu,nan,nan
3397,SNS College of Technology,Coimbatore,Tamil Nadu,nan,nan
3398,SP Degree College,Hyderabad,Telangana,nan,nan
3399,SR Government College for Women Amritsar,Amritsar,Punjab,nan,nan
3400,SR University,Warangal,Telangana,91,nan
3401,"SRI Basaveshwara Government First Grade College, Mayakonda",Mayakonda,Karnataka,nan,nan
3402,"SRI RAMAKRISHNA DENTAL COLLEGE AND HOSPITAL, COIMBATORE",Coimbatore,Tamil Nadu,nan,nan
3403,SRI SADGURU SAI DEGREE COLLEGE,VIZIANAGARAM,Andhra Pradesh,nan,nan
3404,SRI Shirdi Sai Srinivasa Degree College,Vizianagaram,Andhra Pradesh,nan,nan
3405,"SRK Institute of Technology, Enikepadu",VIJAYAWADA,Andhra Pradesh,nan,nan
3406,SRM Arts and Science College,Kanchipuram,Tamil Nadu,nan,nan
3407,SRM Dental College,Chennai,Tamil Nadu,8,nan
3408,"SRM University, Delhi NCR",Sonepat,Haryana,nan,nan
3409,SRM Valliammai Engineering College,Chennai,Tamil Nadu,nan,nan
3410,SS Girls College,GONDIYA,Maharashtra,nan,nan
3411,SSBT's College of Engineering & Technology,Jalgaon,Maharashtra,nan,nan
3412,"SSE Co-Op S`s Late R.B.Garud Kala & Wanijya Mahavidyalaya, Shendurni",Shendurni,Maharashtra,nan,nan
3413,SSM College of Engineering,Namakkal,Tamil Nadu,nan,nan
3414,SSM College of Engineering,Baramula,Jammu and Kashmir,nan,nan
3415,SSM Institute of Engineering and Technology,Dindigul,Tamil Nadu,nan,nan
3416,"SSVPS`s Bhausaheb N.S. Patil Arts & M.F.M.A. Commerce College, Dhule",Dhule,Maharashtra,nan,nan
3417,ST Anns College of Engineering and Technology,CHIRALA,Andhra Pradesh,nan,nan
3418,"ST. ANDREW COLLEGE OF ARTS, SCIENCE & COMMERCE, MUMBAI",Mumbai,Maharashtra,nan,nan
3419,ST. Joseph Engineering College,Mangaluru,Karnataka,nan,nan
3420,"ST. Thomas College, Thrissur",Thrissur,Kerala,nan,nan
3421,"SVCR Degree College, Palamaner Rural",Palamaner,Andhra Pradesh,nan,nan
3422,SVKM`s Narsee Monjee Institute of Management Studies,Mumbai,Maharashtra,nan,51
3423,SVKM`s Narsee Monjee Institute of Management Studies,nan,nan,25,nan
3424,"SVM Arts/Science/Commerce College, Ilkal",Bagalkot,Karnataka,nan,nan
3425,"SVR Engineering College, Nandyal",Nandyal,Andhra Pradesh,nan,nan
3426,Sacred Heart College,Ernakulam,Kerala,nan,nan
3427,Sacred Heart College,Chalakudy,Kerala,nan,nan
3428,Sacred Heart College (Autonomous),Tirupattur,Tamil Nadu,nan,nan
3429,Sacred Heart Degree College for Women,Bengaluru,Karnataka,nan,nan
3430,"Sacred Heart Institute of Management and Technology, Sitapur",SITAPUR,Uttar Pradesh,nan,nan
3431,"Sadakathullah Appa College, Rahmath Nagar, Palayamkottai",Tirunelveli,Tamil Nadu,nan,nan
3432,Sadguru Gadge Maharaja College,Satara,Maharashtra,nan,nan
3433,"Sadhana Education Societys L S Raheja College of Arts and Commerce, Mumbai",MUMBAI,Maharashtra,nan,nan
3434,Sadhubella Education Societys J Watumull Sadhubella Girls College,Ulhasnagar,Maharashtra,nan,nan
3435,Sagar Institute of Research & Technology,Bhopal,Madhya Pradesh,nan,nan
3436,Sagar Institute of Research & Technology Excellence,Bhopal,Madhya Pradesh,nan,nan
3437,Sagar Institute of Science & Technology,Bhopal,Madhya Pradesh,nan,nan
3438,Sagar Institute of Science Technology & Research (SISTEC-R),Bhopal,Madhya Pradesh,nan,nan
3439,Sagar Institute of Technology and Management,Barabanki,Uttar Pradesh,nan,nan
3440,Sagi Ramakrishnam Raju Engin,Bhimavaram,Andhra Pradesh,292,nan
3441,Sagi Ramakrishnam Raju Engineering College,Bhimavaram,Andhra Pradesh,nan,nan
3442,Sahakar Maharshi Late Bhaskarrao Shingne Arts College,Dist. Buldana,Maharashtra,nan,nan
3443,"Sahakar Maharshi Shankarrao Mohite Patil Institute of Technology and Research, Shankarnagar",Akluj,Maharashtra,nan,nan
3444,Saheed Anurup Ch. Mahavidyalaya,Kolkata,West Bengal,nan,nan
3445,"Sahibaganj College, Sahibaganj",Sahibganj,Jharkhand,nan,nan
3446,Sahrdaya College of Engineering & Technology,Kodakara,Kerala,nan,nan
3447,"Sahyadri Bahujan Vidya Prasarak Samajs Sahakarmaharshi Bhausaheb Santuji Thorat College of Arts, Science & Commerce, Dist.Ahmednagar",Ahmadnagar,Maharashtra,nan,nan
3448,Sahyadri College of Engineering & Management,Mangaluru,Karnataka,nan,nan
3449,"Sahyadri Shaikshan Seva Mandals College of Arts and Commerce, Dist Thane",Vasai Virar,Maharashtra,nan,nan
3450,Sai Rajeswari Institute of Technology,Proddatur,Andhra Pradesh,nan,nan
3451,Sai Vidya Institute of Technology,Bengaluru,Karnataka,nan,nan
3452,Saintgits College of Engineering,Kottayam,Kerala,nan,nan
3453,"Sakthi College of Arts and Science for Women, Oddanchatram",Dindigul,Tamil Nadu,nan,nan
3454,Sakus Mission College,Dimapur,Nagaland,nan,nan
3455,Salem Sowdeswari College,Salem,Tamil Nadu,nan,nan
3456,"Salipur College, Salippur, Cuttack",Cuttack,Odisha,nan,nan
3457,"Samrat Ashok Technological Institute, Vidisha",Vidisha,Madhya Pradesh,nan,nan
3458,"Sanatana Dharma College, Alappuzha",Alappuzha,Kerala,nan,nan
3459,Sandan Lal Sanwal Das Khanna Mahila Mahavidyalaya,Prayagraj,Uttar Pradesh,nan,nan
3460,Sandip Foundation's Sandip Institute of Engineering and Management,Nashik,Maharashtra,nan,nan
3461,Sangameshwar College,Solapur,Maharashtra,nan,nan
3462,"Sangola College, Sangola Dist-Solapur",Solapur,Maharashtra,nan,nan
3463,Sanjay Gandhi Postgraduate Institute of Medical Sciences,nan,nan,7,nan
3464,Sanjay Gandhi Postgraduate Institute of Medical Sciences,Lucknow,Uttar Pradesh,nan,nan
3465,Sanjivani Rural Education Society`s College of Engineering,Kopargaon,Maharashtra,nan,nan
3466,"Sanjivani Rural Education Society`s Sanjivani Arts, Commerce and Science College",Kopargaon,Maharashtra,nan,nan
3467,"Sankalchand Patel University, Visnagar",Visnagar,Gujarat,nan,nan
3468,Sankara College of Science and Commerce,Coimbatore,Tamil Nadu,nan,nan
3469,Sankardev Mahavidiyalaya,Lakhimpur,Assam,nan,nan
3470,Sanketika Vidya Parishad Engineering College,Visakhapatnam,Andhra Pradesh,nan,nan
3471,Sanskar College of Architecture and Planning,Hapur,Uttar Pradesh,nan,nan
3472,Sanskar College of Engineering & Technology,Ghaziabad,Uttar Pradesh,nan,nan
3473,Sanskrithi School of Engineering,Puttaparthi,Andhra Pradesh,nan,nan
3474,Sanskriti University,MATHURA,Uttar Pradesh,nan,nan
3475,Sant Dnyaneshwar Mahavidyalya Soegaon,Soegaon,Maharashtra,nan,nan
3476,"Sant Gadge Baba Maharaj Art, Commerce & Science College, Walgaon",Walgaon,Maharashtra,nan,nan
3477,"Sant Gajanan Maharaj College of Engineering, Kolhapur",Mahagaon,Maharashtra,nan,nan
3478,Sant Longowal Institute of Engineering & Technology,Longowal,Punjab,178,nan
3479,Santhiram Engineering College,Nandyal,Andhra Pradesh,nan,nan
3480,Saptratna Bahuuddeshiya sevabhavi Sanstha v Shikshan Prasarak Mandal Sanchalit B Kedar Computer and Management Science College,Shirur Kasar,Maharashtra,nan,nan
3481,Saradha Gangadharan College,Puducherry,Pondicherry,nan,nan
3482,"Sarah Tucker College, Palayamkottai",Tirunelveli,Tamil Nadu,nan,nan
3483,Saraighat College,Kamrup,Assam,nan,nan
3484,Saranathan College of Engineering,Tiruchirappalli,Tamil Nadu,nan,nan
3485,Saraswat Vidyalayas Sridora Caculo College of Commerce & Management Studies,North Goa,Goa,nan,nan
3486,Saraswati Bhuvan College of Arts & Commerce,Aurangabad,Maharashtra,nan,nan
3487,Saraswati Bhuvan College of Science,Aurangabad,Maharashtra,nan,nan
3488,Saraswati Education Society`s Saraswati College of Engineering,Navi Mumbai,Maharashtra,nan,nan
3489,"Saraswati Higher Education and Technical College of Engineering, Varanasi",VARANASI,Uttar Pradesh,nan,nan
3490,Saraswati Mahila Mahavidyalaya,Palwal,Haryana,nan,nan
3491,Sardar Patel College,Chandrapur,Maharashtra,nan,nan
3492,Sardar Patel College of Engineering,Mumbai,Maharashtra,nan,nan
3493,Sardar Patel Post Graduate Institute of Dental and Medical Sciences,LUCKNOW,Uttar Pradesh,nan,nan
3494,Sardar Vallabhbhai National Institute of Technology,Surat,Gujarat,58,nan
3495,Sardar Vallabhbhai Patel International School of Textiles and Management,Coimbatore,Tamil Nadu,nan,nan
3496,"Sariya College, Sariya","Suriya, Giridih",Jharkhand,nan,nan
3497,Sarojini Naidu College For Women,North Twenty Four Parganas,West Bengal,nan,nan
3498,Sarvajanik College of Engineering & Technology,Surat,Gujarat,nan,nan
3499,"Sarvajanik College of Engineering & Technology, Faculty of Architecture",Surat-,Gujarat,nan,nan
3500,Sarvajanik College of Law,Surat,Gujarat,nan,nan
3501,Sarvodaya Mahavidyalaya,Chandrapur,Maharashtra,nan,nan
3502,Sasi Creative School of Architecture,Coimbatore,Tamil Nadu,nan,nan
3503,Sasi Institute of Technology & Engineering,Tadepalligudem,Andhra Pradesh,nan,nan
3504,Sasmira`s Institute of Commerce and Science,Mumbai,Maharashtra,nan,nan
3505,"Satavahana University, Karimnagar",Gambhiraopet,Telangana,nan,nan
3506,Sathyabama Institute of Science and Technology,Chennai,Tamil Nadu,nan,43
3507,"Satish Pradhan Dnyansadhana College, Thane (Arts, Science and Commerce )",Thane,Maharashtra,nan,nan
3508,Satya Degree College (Formerly S. B. G. N. M. Degree College),Vizianagaram,Andhra Pradesh,nan,nan
3509,Satya Krishna Degree College,Vizianagaram,Andhra Pradesh,nan,nan
3510,Satya Rama Degree College,Vizianagaram,Andhra Pradesh,nan,nan
3511,Satyawati College,DELHI,Delhi,nan,nan
3512,Saveetha Engineering College,Sriperumbudur,Tamil Nadu,nan,nan
3513,Saveetha Institute of Medical and Technical Sciences,nan,nan,25,nan
3514,Saveetha Institute of Medical and Technical Sciences,Chennai,Tamil Nadu,nan,26
3515,Savitribai Phule Mahila Mahavidyalaya,Satara,Maharashtra,nan,nan
3516,Savitribai Phule Pune University,Pune,Maharashtra,nan,12
3517,Savitribai Phule Pune University ,Pune,Maharashtra,nan,nan
3518,Sawai Man Singh Medical College,Jaipur,Rajasthan,nan,nan
3519,Sawai Man Singh Medical College,nan,nan,41,nan
3520,Scholar's Institute Of Technology & Management,Guwahati,Assam,nan,nan
3521,"School of Architecture, Indore",Indore,Madhya Pradesh,nan,nan
3522,"School of Communication, Manipal",Udupi,Karnataka,nan,nan
3523,School of Engineering and Technology,Soldha,Haryana,nan,nan
3524,"School of Engineering, Cochin University of Science and Technology",Cochin,Kerala,nan,nan
3525,"School of Planning & Architecture, Vijayawada",Vijayawada,Andhra Pradesh,7,nan
3526,"School of Planning and Architecture, Bhopal",Bhopal,Madhya Pradesh,10,nan
3527,"School of Planning and Architecture, New Delhi",New Delhi,Delhi,4,nan
3528,"School of Social Work, Roshni Nilaya, Mangalore",Dakshina Kannada,Karnataka,nan,nan
3529,Science College,Kokrajhar,Assam,nan,nan
3530,Science College,Nanded,Maharashtra,nan,nan
3531,Scient Institute of Technology,Hyderabad,Telangana,nan,nan
3532,Scope College of Engineering,Bhopal,Madhya Pradesh,nan,nan
3533,"Scott Christian College, Nagercoil",Nagercoil,Tamil Nadu,nan,nan
3534,Scottish Church College,Kolkata,West Bengal,nan,nan
